{
  "schema": 1,
  "n": 1,
  "changeId": "CHG-0018",
  "cycle": 1,
  "worktree": "CHG-0018/export-fix",
  "headSha": "f5b7a3e6b1c0d9e8f7a6b5c4d3e2f1a0b9c8d7e6",
  "fileSet": [
    "src/export/csv.ts"
  ],
  "configRef": {
    "claudeMdSha": "56c1747b05154ff91dbd64fdf6dff59e12465a8e",
    "skills": [
      {
        "name": "brand",
        "version": "a74c76fd9e99d651acca91e10f8c28ccd6ce3b41"
      }
    ],
    "hooksSha": "a913fb3eee604f92e9cfbbce14f0c537819163e2",
    "model": "claude-opus-5"
  },
  "results": [
    {
      "caseId": "CASE-0001",
      "pass": false,
      "output": "1 failed: zero-total row missing"
    }
  ],
  "commandResults": [
    {
      "name": "build",
      "cmd": "pnpm build",
      "exitCode": 0,
      "pass": true,
      "output": "tsc -b\n"
    },
    {
      "name": "test",
      "cmd": "pnpm test",
      "exitCode": 1,
      "pass": false,
      "output": "Tests 1 failed | 44 passed (45)\n  ✗ zero-total row missing\n"
    },
    {
      "name": "lint",
      "cmd": "pnpm lint",
      "exitCode": 0,
      "pass": true,
      "output": ""
    }
  ],
  "verdict": "red",
  "startedAt": "2026-09-02T09:30:00Z",
  "finishedAt": "2026-09-02T09:34:00Z"
}
